#Name,Accession,Start,Stop,Strand,GeneID,Locus,Locus tag,Protein product,Length,Protein Name
"chromosome","NZ_CP032803.1",379,2268,"+",,"mnmG","D8Z70_RS00005","WP_000499793.1",629,"tRNA uridine-5-carboxymethylaminomethyl(34) synthesis enzyme MnmG"
"chromosome","NZ_CP032803.1",2332,2955,"+",,"rsmG","D8Z70_RS00010","WP_000932839.1",207,"MULTISPECIES: 16S rRNA (guanine(527)-N(7))-methyltransferase RsmG"
"chromosome","NZ_CP032803.1",3572,3952,"+",,"atpI","D8Z70_RS00015","WP_000116695.1",126,"MULTISPECIES: F0F1 ATP synthase subunit I"
"chromosome","NZ_CP032803.1",3961,4776,"+",,"atpB","D8Z70_RS00020","WP_000135625.1",271,"MULTISPECIES: F0F1 ATP synthase subunit A"
"chromosome","NZ_CP032803.1",4823,5062,"+",,"atpE","D8Z70_RS00025","WP_000429386.1",79,"MULTISPECIES: F0F1 ATP synthase subunit C"
"chromosome","NZ_CP032803.1",5124,5594,"+",,"atpF","D8Z70_RS00030","WP_001052219.1",156,"MULTISPECIES: F0F1 ATP synthase subunit B"
"chromosome","NZ_CP032803.1",5609,6142,"+",,"atpH","D8Z70_RS00035","WP_001288587.1",177,"MULTISPECIES: F0F1 ATP synthase subunit delta"
"chromosome","NZ_CP032803.1",6155,7696,"+",,"atpA","D8Z70_RS00040","WP_001176745.1",513,"MULTISPECIES: F0F1 ATP synthase subunit alpha"
"chromosome","NZ_CP032803.1",7747,8610,"+",,"atpG","D8Z70_RS00045","WP_000896498.1",287,"MULTISPECIES: F0F1 ATP synthase subunit gamma"
"chromosome","NZ_CP032803.1",8637,10019,"+",,"atpD","D8Z70_RS00050","WP_000190506.1",460,"MULTISPECIES: F0F1 ATP synthase subunit beta"
"chromosome","NZ_CP032803.1",10040,10459,"+",,"atpC","D8Z70_RS00055","WP_001251965.1",139,"MULTISPECIES: F0F1 ATP synthase subunit epsilon"
"chromosome","NZ_CP032803.1",10811,12181,"+",,"glmU","D8Z70_RS00060","WP_000933736.1",456,"MULTISPECIES: bifunctional UDP-N-acetylglucosamine diphosphorylase/glucosamine-1-phosphate N-acetyltransferase GlmU"
"chromosome","NZ_CP032803.1",12343,14172,"+",,"glmS","D8Z70_RS00065","WP_000334100.1",609,"glutamine--fructose-6-phosphate transaminase (isomerizing)"
"chromosome","NZ_CP032803.1",14872,15474,"+",,"lpfA2","D8Z70_RS00070","WP_000804045.1",200,"MULTISPECIES: long polar fimbria major subunit LpfA2"
"chromosome","NZ_CP032803.1",16101,16262,"+",,,"D8Z70_RS00080","WP_001310364.1",53,"fimbrial chaperone"
"chromosome","NZ_CP032803.1",16284,18818,"+",,,"D8Z70_RS00085","WP_000168513.1",844,"fimbrial biogenesis outer membrane usher protein"
"chromosome","NZ_CP032803.1",18830,19900,"+",,,"D8Z70_RS00090","WP_000722803.1",356,"fimbrial protein"
"chromosome","NZ_CP032803.1",19928,21010,"+",,,"D8Z70_RS00095","WP_001301944.1",360,"fimbrial protein"
"chromosome","NZ_CP032803.1",21222,22262,"+",,"pstS","D8Z70_RS00100","WP_000867143.1",346,"MULTISPECIES: phosphate ABC transporter substrate-binding protein PstS"
"chromosome","NZ_CP032803.1",22349,23308,"+",,"pstC","D8Z70_RS00105","WP_000741620.1",319,"MULTISPECIES: phosphate ABC transporter permease PstC"
"chromosome","NZ_CP032803.1",23308,24198,"+",,"pstA","D8Z70_RS00110","WP_001251991.1",296,"MULTISPECIES: phosphate ABC transporter permease PstA"
"chromosome","NZ_CP032803.1",24381,25154,"+",,"pstB","D8Z70_RS00115","WP_000063125.1",257,"MULTISPECIES: phosphate ABC transporter ATP-binding protein PstB"
"chromosome","NZ_CP032803.1",25169,25894,"+",,"phoU","D8Z70_RS00120","WP_000377785.1",241,"MULTISPECIES: phosphate signaling complex protein PhoU"
"chromosome","NZ_CP032803.1",25851,26030,"+",,,"D8Z70_RS00125","WP_001303733.1",59,"hypothetical protein"
"chromosome","NZ_CP032803.1",26132,26338,"+",,,"D8Z70_RS00130","WP_000412703.1",68,"hypothetical protein"
"chromosome","NZ_CP032803.1",26319,26453,"+",,,"D8Z70_RS00135","WP_001304020.1",44,"hypothetical protein"
"chromosome","NZ_CP032803.1",26420,28804,"+",,,"D8Z70_RS00140","WP_001310363.1",794,"hypothetical protein"
"chromosome","NZ_CP032803.1",28995,29174,"+",,,"D8Z70_RS00145","WP_001301478.1",59,"hypothetical protein"
"chromosome","NZ_CP032803.1",29789,30460,"-",,,"D8Z70_RS00150","WP_000369315.1",223,"hypothetical protein"
"chromosome","NZ_CP032803.1",30761,33169,"+",,"espY4","D8Z70_RS00155","WP_000225947.1",802,"T3SS effector EspY4"
"chromosome","NZ_CP032803.1",33306,33971,"-",,"yieH","D8Z70_RS00160","WP_000078064.1",221,"6-phosphogluconate phosphatase"
"chromosome","NZ_CP032803.1",34137,35474,"+",,,"D8Z70_RS00165","WP_001301685.1",445,"adenine permease AdeP"
"chromosome","NZ_CP032803.1",35528,36094,"-",,"yieF","D8Z70_RS00170","WP_001291268.1",188,"MULTISPECIES: class I chromate reductase YieF"
"chromosome","NZ_CP032803.1",36116,36865,"-",,,"D8Z70_RS00175","WP_001302247.1",249,"hypothetical protein"
"chromosome","NZ_CP032803.1",37022,37981,"-",,"yidZ","D8Z70_RS00180","WP_000748496.1",319,"HTH-type transcriptional regulator YidZ"
"chromosome","NZ_CP032803.1",37956,39131,"-",,"mdtL","D8Z70_RS00185","WP_000086017.1",391,"multidrug efflux MFS transporter MdtL"
"chromosome","NZ_CP032803.1",39263,40510,"-",,"tnaB","D8Z70_RS00190","WP_000131901.1",415,"low affinity tryptophan permease TnaB"
"chromosome","NZ_CP032803.1",40601,42016,"-",,"tnaA","D8Z70_RS00195","WP_001302010.1",471,"tryptophanase"
"chromosome","NZ_CP032803.1",42237,42311,"-",,"tnaC","D8Z70_RS00200","WP_001364348.1",24,"MULTISPECIES: tryptophanase leader peptide"
"chromosome","NZ_CP032803.1",45030,46394,"-",,"mnmE","D8Z70_RS00210","WP_001282345.1",454,"tRNA uridine-5-carboxymethylaminomethyl(34) synthesis GTPase MnmE"
"chromosome","NZ_CP032803.1",46500,48146,"-",,"yidC","D8Z70_RS00215","WP_000378258.1",548,"MULTISPECIES: membrane protein insertase YidC"
"chromosome","NZ_CP032803.1",48149,48406,"-",,"yidD","D8Z70_RS00220","WP_001303730.1",85,"membrane protein insertion efficiency factor YidD"
"chromosome","NZ_CP032803.1",48370,48729,"-",,"rnpA","D8Z70_RS00225","WP_000239733.1",119,"ribonuclease P protein component"
"chromosome","NZ_CP032803.1",48746,48886,"-",,"rpmH","D8Z70_RS00230","WP_000831330.1",46,"MULTISPECIES: 50S ribosomal protein L34"
"chromosome","NZ_CP032803.1",49116,49196,"-",,,"D8Z70_RS00235","WP_120795392.1",26,"MULTISPECIES: protein YsdD"
"chromosome","NZ_CP032803.1",49493,50896,"+",,"dnaA","D8Z70_RS00240","WP_000059116.1",467,"chromosomal replication initiator protein DnaA"
"chromosome","NZ_CP032803.1",50901,52001,"+",,"dnaN","D8Z70_RS00245","WP_000673464.1",366,"MULTISPECIES: DNA polymerase III subunit beta"
"chromosome","NZ_CP032803.1",52001,53074,"+",,"recF","D8Z70_RS00250","WP_000060112.1",357,"MULTISPECIES: DNA replication/repair protein RecF"
"chromosome","NZ_CP032803.1",53103,55517,"+",,"gyrB","D8Z70_RS00255","WP_000072067.1",804,"MULTISPECIES: DNA topoisomerase (ATP-hydrolyzing) subunit B"
"chromosome","NZ_CP032803.1",55748,56155,"+",,,"D8Z70_RS00260","WP_010904953.1",135,"YidB family protein"
"chromosome","NZ_CP032803.1",56270,57082,"+",,,"D8Z70_RS00265","WP_000985542.1",270,"sugar-phosphatase"
"chromosome","NZ_CP032803.1",57128,57784,"-",,,"D8Z70_RS00270","WP_000772953.1",218,"hypothetical protein"
"chromosome","NZ_CP032803.1",58030,59094,"-",,"cbrA","D8Z70_RS00275","WP_001302380.1",354,"colicin M resistance protein"
"chromosome","NZ_CP032803.1",59162,60409,"+",,,"D8Z70_RS00280","WP_001302515.1",415,"DUF3748 domain-containing protein"
"chromosome","NZ_CP032803.1",60411,60743,"-",,,"D8Z70_RS00285","WP_001313407.1",110,"MULTISPECIES: YceK/YidQ family lipoprotein"
"chromosome","NZ_CP032803.1",61049,61462,"+",,"ibpA","D8Z70_RS00290","WP_001243437.1",137,"MULTISPECIES: heat shock chaperone IbpA"
"chromosome","NZ_CP032803.1",61574,62002,"+",,"ibpB","D8Z70_RS00295","WP_001243431.1",142,"MULTISPECIES: heat shock chaperone IbpB"
"chromosome","NZ_CP032803.1",62198,63859,"+",,,"D8Z70_RS00300","WP_001279752.1",553,"MULTISPECIES: putative transporter"
"chromosome","NZ_CP032803.1",63856,64572,"-",,,"D8Z70_RS00305","WP_001301657.1",238,"GntR family transcriptional regulator"
"chromosome","NZ_CP032803.1",64868,66484,"+",,,"D8Z70_RS00310","WP_000952127.1",538,"MULTISPECIES: PTS sugar transporter subunit IIB"
"chromosome","NZ_CP032803.1",66484,67806,"+",,,"D8Z70_RS00315","WP_000160122.1",440,"6-phospho-alpha-glucosidase"
"chromosome","NZ_CP032803.1",67803,68696,"-",,,"D8Z70_RS00320","WP_001301844.1",297,"AraC family transcriptional regulator"
"chromosome","NZ_CP032803.1",68863,70578,"+",,,"D8Z70_RS00325","WP_001087120.1",571,"solute:sodium symporter family transporter"
"chromosome","NZ_CP032803.1",70575,72068,"+",,,"D8Z70_RS00330","WP_000828465.1",497,"sulfatase-like hydrolase/transferase"
"chromosome","NZ_CP032803.1",72115,72564,"-",,,"D8Z70_RS00335","WP_000511301.1",149,"hypothetical protein"
"chromosome","NZ_CP032803.1",72673,73020,"+",,,"D8Z70_RS00340","WP_000703959.1",115,"MULTISPECIES: YidH family protein"
"chromosome","NZ_CP032803.1",73010,73372,"+",,,"D8Z70_RS00345","WP_001113432.1",120,"MULTISPECIES: DUF202 domain-containing protein"
"chromosome","NZ_CP032803.1",73369,73866,"+",,,"D8Z70_RS00350","WP_000148051.1",165,"radical SAM protein"
"chromosome","NZ_CP032803.1",73874,75058,"-",,"emrD","D8Z70_RS00355","WP_001457744.1",394,"multidrug efflux MFS transporter EmrD"
"chromosome","NZ_CP032803.1",75338,75427,"-",,"tisB","D8Z70_RS00360","WP_000060506.1",29,"MULTISPECIES: type I toxin-antitoxin system toxin TisB"
"chromosome","NZ_CP032803.1",75992,76090,"+",,"ivbL","D8Z70_RS00365","WP_010904951.1",32,"ilvB operon leader peptide IvbL"
"chromosome","NZ_CP032803.1",76196,77884,"+",,"ilvB","D8Z70_RS00370","WP_000168421.1",562,"acetolactate synthase large subunit"
"chromosome","NZ_CP032803.1",77888,78178,"+",,"ilvN","D8Z70_RS00375","WP_001181706.1",96,"MULTISPECIES: acetolactate synthase small subunit"
"chromosome","NZ_CP032803.1",78471,79094,"+",,,"D8Z70_RS00380","WP_001284804.1",207,"hypothetical protein"
"chromosome","NZ_CP032803.1",79242,79724,"+",,,"D8Z70_RS00385","WP_000229982.1",160,"hypothetical protein"
"chromosome","NZ_CP032803.1",80332,81435,"+",,,"D8Z70_RS00390","WP_001089794.1",367,"hypothetical protein"
"chromosome","NZ_CP032803.1",81597,82187,"+",,"uhpA","D8Z70_RS00395","WP_000633668.1",196,"MULTISPECIES: transcriptional regulator UhpA"
"chromosome","NZ_CP032803.1",82187,83689,"+",,"uhpB","D8Z70_RS00400","WP_001303725.1",500,"signal transduction histidine-protein kinase/phosphatase UhpB"
"chromosome","NZ_CP032803.1",83699,85018,"+",,"uhpC","D8Z70_RS00405","WP_001301991.1",439,"MULTISPECIES: MFS transporter family glucose-6-phosphate receptor UhpC"
"chromosome","NZ_CP032803.1",85156,86547,"+",,"uhpT","D8Z70_RS00410","WP_000879194.1",463,"MULTISPECIES: hexose-6-phosphate:phosphate antiporter"
"chromosome","NZ_CP032803.1",86593,88359,"-",,"adeD","D8Z70_RS00415","WP_001065705.1",588,"adenine deaminase"
"chromosome","NZ_CP032803.1",89920,90372,"+",,,"D8Z70_RS00425","WP_001295241.1",150,"MULTISPECIES: DUF1198 domain-containing protein"
"chromosome","NZ_CP032803.1",90488,90811,"-",,,"D8Z70_RS00430","WP_000125646.1",107,"MULTISPECIES: DNA-binding transcriptional regulator"
"chromosome","NZ_CP032803.1",90795,91148,"-",,,"D8Z70_RS00435","WP_001301594.1",117,"type II toxin-antitoxin system RelE/ParE family toxin"
"chromosome","NZ_CP032803.1",91107,91298,"+",,,"D8Z70_RS00440","WP_032101956.1",63,"hypothetical protein"
"chromosome","NZ_CP032803.1",91382,92572,"+",,"nepI","D8Z70_RS00445","WP_001288545.1",396,"purine ribonucleoside efflux pump NepI"
"chromosome","NZ_CP032803.1",92613,92906,"-",,,"D8Z70_RS00450","WP_001302207.1",97,"MULTISPECIES: hypothetical protein"
"chromosome","NZ_CP032803.1",93128,93946,"+",,"nlpA","D8Z70_RS00455","WP_000779412.1",272,"lipoprotein NlpA"
"chromosome","NZ_CP032803.1",93950,94873,"-",,,"D8Z70_RS00460","WP_000535951.1",307,"DMT family transporter"
"chromosome","NZ_CP032803.1",94915,95121,"+",,,"D8Z70_RS00465","WP_001310360.1",68,"MULTISPECIES: hypothetical protein"
"chromosome","NZ_CP032803.1",95893,96711,"-",,,"D8Z70_RS00475","WP_000823897.1",272,"YjiK family protein"
"chromosome","NZ_CP032803.1",96839,97984,"-",,"espG","D8Z70_RS00480","WP_001301460.1",381,"type III secretion system LEE effector EspG"
"chromosome","NZ_CP032803.1",99298,99669,"+",,"ler","D8Z70_RS00485","WP_001055728.1",123,"MULTISPECIES: type III secretion system LEE master regulator Ler"
"chromosome","NZ_CP032803.1",99684,99902,"+",,"escE","D8Z70_RS00490","WP_000628731.1",72,"MULTISPECIES: YscE family type III secretion system co-chaperone EscE"
"chromosome","NZ_CP032803.1",99915,100229,"+",,"cesAB","D8Z70_RS00495","WP_001301632.1",104,"MULTISPECIES: type III secretion system LEE chaperone CesAB"
"chromosome","NZ_CP032803.1",100226,100825,"+",,,"D8Z70_RS00500","WP_000151812.1",199,"hypothetical protein"
"chromosome","NZ_CP032803.1",100812,101465,"+",,"espL","D8Z70_RS00505","WP_000780681.1",217,"type III secretion system LEE stator protein EspL"
"chromosome","NZ_CP032803.1",101470,102123,"+",,"escR","D8Z70_RS00510","WP_001299599.1",217,"MULTISPECIES: type III secretion system LEE export apparatus protein EscR"
"chromosome","NZ_CP032803.1",102123,102392,"+",,"escS","D8Z70_RS00515","WP_000379425.1",89,"MULTISPECIES: type III secretion system LEE export apparatus protein EscS"
"chromosome","NZ_CP032803.1",102392,103168,"+",,"escT","D8Z70_RS00520","WP_001002833.1",258,"MULTISPECIES: type III secretion system LEE export apparatus protein EscT"
"chromosome","NZ_CP032803.1",103161,104198,"+",,"escU","D8Z70_RS00525","WP_001291694.1",345,"type III secretion system LEE export apparatus switch protein EscU"
"chromosome","NZ_CP032803.1",104195,104653,"-",,"etgA","D8Z70_RS00530","WP_000720639.1",152,"MULTISPECIES: type III secretion system LEE muramidase EtgA"
"chromosome","NZ_CP032803.1",104849,105220,"+",,"grlR","D8Z70_RS00535","WP_000605370.1",123,"type III secretion system LEE GrlA-binding negative regulator GrlR"
"chromosome","NZ_CP032803.1",105275,105688,"+",,"grlA","D8Z70_RS00540","WP_000444180.1",137,"type III secretion system LEE transcriptional regulator GrlA"
"chromosome","NZ_CP032803.1",106072,106527,"-",,"cesD","D8Z70_RS00545","WP_000087467.1",151,"MULTISPECIES: SycD/LcrH family type III secretion system chaperone CesD"
"chromosome","NZ_CP032803.1",106541,108079,"-",,"escC","D8Z70_RS00550","WP_000723942.1",512,"type III secretion system LEE outer membrane ring protein EscC"
"chromosome","NZ_CP032803.1",108079,108534,"-",,"sepD","D8Z70_RS00555","WP_001063681.1",151,"type III secretion system LEE switch protein SepD"
"chromosome","NZ_CP032803.1",108540,109112,"-",,"escJ","D8Z70_RS00560","WP_000716189.1",190,"MULTISPECIES: type III secretion system LEE inner membrane ring protein EscJ"
"chromosome","NZ_CP032803.1",109115,109492,"-",,,"D8Z70_RS00565","WP_001302733.1",125,"type III secretion system inner rod subunit SctI"
"chromosome","NZ_CP032803.1",109576,109875,"-",,"espZ","D8Z70_RS00570","WP_000386949.1",99,"MULTISPECIES: type III secretion system LEE cytoprotective effector EspZ"
"chromosome","NZ_CP032803.1",110060,110413,"+",,"cesL","D8Z70_RS00575","WP_001050992.1",117,"MULTISPECIES: type III secretion system LEE chaperone CesL"
"chromosome","NZ_CP032803.1",110410,112437,"+",,"escV","D8Z70_RS00580","WP_001037814.1",675,"type III secretion system LEE export apparatus protein EscV"
"chromosome","NZ_CP032803.1",112421,113761,"+",,"escN","D8Z70_RS00585","WP_000622545.1",446,"MULTISPECIES: type III secretion system LEE ATPase EscN"
"chromosome","NZ_CP032803.1",113821,114141,"+",,,"D8Z70_RS00590","WP_001062956.1",106,"MULTISPECIES: hypothetical protein"
"chromosome","NZ_CP032803.1",114134,114550,"+",,"escP","D8Z70_RS00595","WP_001303723.1",138,"MULTISPECIES: type III secretion system LEE needle length regulator EscP"
"chromosome","NZ_CP032803.1",114513,115430,"+",,"escQ","D8Z70_RS00600","WP_000803687.1",305,"type III secretion system LEE ring protein EscQ"
"chromosome","NZ_CP032803.1",115461,115967,"+",,"espH","D8Z70_RS00605","WP_001302249.1",168,"type III secretion system LEE effector EspH"
"chromosome","NZ_CP032803.1",116165,116548,"-",,"cesF","D8Z70_RS00610","WP_001003065.1",127,"type III secretion system LEE chaperone CesF"
"chromosome","NZ_CP032803.1",116814,117425,"+",,"map","D8Z70_RS00615","WP_000492638.1",203,"type III secretion system LEE effector Map (Rho guanine exchange factor)"
"chromosome","NZ_CP032803.1",117849,119525,"+",,"tir","D8Z70_RS00620","WP_001457743.1",558,"type III secretion system LEE translocated intimin receptor Tir"
"chromosome","NZ_CP032803.1",119663,120133,"+",,"cesT","D8Z70_RS00625","WP_000098793.1",156,"MULTISPECIES: type III secretion system LEE chaperone CesT"
"chromosome","NZ_CP032803.1",120193,122997,"+",,"eae","D8Z70_RS00630","WP_151547362.1",934,"intimin type gamma"
"chromosome","NZ_CP032803.1",123261,124481,"-",,"escD","D8Z70_RS00635","WP_000953255.1",406,"MULTISPECIES: type III secretion system LEE inner membrane ring protein EscD"
"chromosome","NZ_CP032803.1",124624,125679,"+",,"sepL","D8Z70_RS00640","WP_001273445.1",351,"type III secretion system LEE gatekeeper SepL"
"chromosome","NZ_CP032803.1",125738,126316,"+",,"espA","D8Z70_RS00645","WP_000381516.1",192,"type III secretion system LEE translocon filament protein EspA"
"chromosome","NZ_CP032803.1",126329,127453,"+",,"espD","D8Z70_RS00650","WP_000935759.1",374,"MULTISPECIES: type III secretion system LEE translocon pore-forming subunit EspD"
"chromosome","NZ_CP032803.1",127474,128412,"+",,"espB","D8Z70_RS00655","WP_001092000.1",312,"type III secretion system LEE translocon pore-forming subunit EspB"
"chromosome","NZ_CP032803.1",128419,128826,"+",,"cesD2","D8Z70_RS00660","WP_000228583.1",135,"LcrR family type III secretion system chaperone CesD2"
"chromosome","NZ_CP032803.1",128862,129083,"+",,"escF","D8Z70_RS00665","WP_001053840.1",73,"MULTISPECIES: type III secretion system LEE needle filament protein EscF"
"chromosome","NZ_CP032803.1",129089,129367,"+",,"escG","D8Z70_RS00670","WP_000245816.1",92,"type III secretion system LEE needle protein cochaperone EscG"
"chromosome","NZ_CP032803.1",129452,130198,"+",,"espF","D8Z70_RS00675","WP_000931693.1",248,"type III secretion system LEE effector EspF"
"chromosome","NZ_CP032803.1",130633,130866,"-",,,"D8Z70_RS00685","WP_000231738.1",77,"hypothetical protein"
"chromosome","NZ_CP032803.1",131063,132601,"-",,,"D8Z70_RS00690","WP_000998048.1",512,"MULTISPECIES: IS66-like element ISEc8 family transposase"
"chromosome","NZ_CP032803.1",132651,132998,"-",,"tnpB","D8Z70_RS00695","WP_000612591.1",115,"MULTISPECIES: IS66 family insertion sequence element accessory protein TnpB"
"chromosome","NZ_CP032803.1",132995,133375,"-",,,"D8Z70_RS00700","WP_001171554.1",126,"MULTISPECIES: IS66 family insertion sequence hypothetical protein"
"chromosome","NZ_CP032803.1",134530,135743,"-",,,"D8Z70_RS00710","WP_085948178.1",404,"MULTISPECIES: IS3 family transposase"
"chromosome","NZ_CP032803.1",135891,136088,"-",,,"D8Z70_RS00715","WP_000202940.1",65,"DUF957 domain-containing protein"
"chromosome","NZ_CP032803.1",136100,136591,"-",,,"D8Z70_RS00720","WP_000976839.1",163,"hypothetical protein"
"chromosome","NZ_CP032803.1",136588,136962,"-",,,"D8Z70_RS00725","WP_000854712.1",124,"toxin"
"chromosome","NZ_CP032803.1",137052,137216,"-",,,"D8Z70_RS00730","WP_000214008.1",54,"type IV toxin-antitoxin system YeeU family antitoxin"
"chromosome","NZ_CP032803.1",138528,139709,"-",,,"D8Z70_RS00740","WP_001219063.1",393,"tyrosine-type recombinase/integrase"
"chromosome","NZ_CP032803.1",140292,141674,"+",,,"D8Z70_RS00750","WP_000834456.1",460,"glycoside-pentoside-hexuronide family transporter"
"chromosome","NZ_CP032803.1",141684,144002,"+",,"yicI","D8Z70_RS00755","WP_000702966.1",772,"alpha-xylosidase"
"chromosome","NZ_CP032803.1",144055,145764,"-",,,"D8Z70_RS00760","WP_001301814.1",569,"AsmA family protein"
"chromosome","NZ_CP032803.1",145885,147276,"-",,"xanP","D8Z70_RS00765","WP_001295238.1",463,"MULTISPECIES: xanthine/proton symporter XanP"
"chromosome","NZ_CP032803.1",147556,148761,"+",,"gltS","D8Z70_RS00770","WP_000468836.1",401,"MULTISPECIES: sodium/glutamate symporter"
"chromosome","NZ_CP032803.1",148764,149630,"+",,,"D8Z70_RS00775","WP_000747329.1",288,"MULTISPECIES: hypothetical protein"
"chromosome","NZ_CP032803.1",149615,151696,"-",,"recG","D8Z70_RS00780","WP_000147776.1",693,"MULTISPECIES: ATP-dependent DNA helicase RecG"
"chromosome","NZ_CP032803.1",151702,152391,"-",,"trmH","D8Z70_RS00785","WP_001070177.1",229,"MULTISPECIES: tRNA (guanosine(18)-2\\'-O)-methyltransferase TrmH"
"chromosome","NZ_CP032803.1",152398,154506,"-",,"spoT","D8Z70_RS00790","WP_000280488.1",702,"MULTISPECIES: bifunctional GTP diphosphokinase/guanosine-3\\',5\\'-bis pyrophosphate 3\\'-pyrophosphohydrolase"
"chromosome","NZ_CP032803.1",154525,154800,"-",,"rpoZ","D8Z70_RS00795","WP_000135058.1",91,"MULTISPECIES: DNA-directed RNA polymerase subunit omega"
"chromosome","NZ_CP032803.1",154855,155478,"-",,,"D8Z70_RS00800","WP_001301691.1",207,"guanylate kinase"
"chromosome","NZ_CP032803.1",155736,157418,"+",,"ligB","D8Z70_RS00805","WP_001303719.1",560,"NAD-dependent DNA ligase LigB"
"chromosome","NZ_CP032803.1",157415,158032,"-",,,"D8Z70_RS00810","WP_000924289.1",205,"MULTISPECIES: trimeric intracellular cation channel family protein"
"chromosome","NZ_CP032803.1",158324,159148,"-",,"dinD","D8Z70_RS00815","WP_001002036.1",274,"DNA damage-inducible protein D"
"chromosome","NZ_CP032803.1",159369,160232,"-",,,"D8Z70_RS00820","WP_000621336.1",287,"MULTISPECIES: YicC family protein"
"chromosome","NZ_CP032803.1",160359,161075,"+",,,"D8Z70_RS00825","WP_001247093.1",238,"MULTISPECIES: ribonuclease PH"
"chromosome","NZ_CP032803.1",161141,161782,"+",,"pyrE","D8Z70_RS00830","WP_000806161.1",213,"MULTISPECIES: orotate phosphoribosyltransferase"
"chromosome","NZ_CP032803.1",161819,162415,"-",,"slmA","D8Z70_RS00835","WP_000818601.1",198,"MULTISPECIES: nucleoid occlusion factor SlmA"
"chromosome","NZ_CP032803.1",162522,162977,"-",,,"D8Z70_RS00840","WP_001298007.1",151,"MULTISPECIES: dUTP diphosphatase"
"chromosome","NZ_CP032803.1",162958,164178,"-",,"coaBC","D8Z70_RS00845","WP_000050139.1",406,"MULTISPECIES: bifunctional phosphopantothenoylcysteine decarboxylase/phosphopantothenate--cysteine ligase CoaBC"
"chromosome","NZ_CP032803.1",164350,165018,"+",,"radC","D8Z70_RS00850","WP_001297375.1",222,"MULTISPECIES: DNA repair protein RadC"
"chromosome","NZ_CP032803.1",165235,165471,"+",,"rpmB","D8Z70_RS00855","WP_000091955.1",78,"MULTISPECIES: 50S ribosomal protein L28"
"chromosome","NZ_CP032803.1",165492,165659,"+",,"rpmG","D8Z70_RS00860","WP_001051798.1",55,"MULTISPECIES: 50S ribosomal protein L33"
"chromosome","NZ_CP032803.1",165757,166566,"+",,"mutM","D8Z70_RS00865","WP_001114533.1",269,"MULTISPECIES: bifunctional DNA-formamidopyrimidine glycosylase/DNA-(apurinic or apyrimidinic site) lyase"
"chromosome","NZ_CP032803.1",166605,167084,"-",,"coaD","D8Z70_RS00870","WP_001171866.1",159,"MULTISPECIES: pantetheine-phosphate adenylyltransferase"
"chromosome","NZ_CP032803.1",167092,168369,"-",,,"D8Z70_RS00875","WP_000891564.1",425,"MULTISPECIES: 3-deoxy-D-manno-octulosonic acid transferase"
"chromosome","NZ_CP032803.1",168782,169840,"+",,"rfaQ","D8Z70_RS00880","WP_000360402.1",352,"MULTISPECIES: lipopolysaccharide core heptosyltransferase RfaQ"
"chromosome","NZ_CP032803.1",169837,170961,"+",,,"D8Z70_RS00885","WP_000634235.1",374,"MULTISPECIES: glycosyltransferase family 4 protein"
"chromosome","NZ_CP032803.1",170954,171751,"+",,"rfaP","D8Z70_RS00890","WP_001301512.1",265,"lipopolysaccharide core heptose(I) kinase RfaP"
"chromosome","NZ_CP032803.1",171794,172801,"+",,"waaO","D8Z70_RS00895","WP_000080643.1",335,"MULTISPECIES: lipopolysaccharide 3-alpha-galactosyltransferase"
"chromosome","NZ_CP032803.1",172827,173534,"+",,"rfaY","D8Z70_RS00900","WP_000639956.1",235,"lipopolysaccharide core heptose(II) kinase RfaY"
"chromosome","NZ_CP032803.1",173559,174572,"+",,,"D8Z70_RS00905","WP_000346017.1",337,"MULTISPECIES: UDP-glucose--(galactosyl) LPS alpha1,2-glucosyltransferase"
"chromosome","NZ_CP032803.1",174581,175723,"+",,,"D8Z70_RS00910","WP_000227811.1",380,"MULTISPECIES: lipopolysaccharide N-acetylglucosaminyltransferase"
"chromosome","NZ_CP032803.1",175759,176967,"-",,"rfaL","D8Z70_RS00915","WP_000204742.1",402,"MULTISPECIES: O-antigen ligase RfaL"
"chromosome","NZ_CP032803.1",176964,177956,"-",,"rfaC","D8Z70_RS00920","WP_001264548.1",330,"lipopolysaccharide heptosyltransferase RfaC"
"chromosome","NZ_CP032803.1",177960,179006,"-",,"rfaF","D8Z70_RS00925","WP_000699232.1",348,"ADP-heptose--LPS heptosyltransferase RfaF"
"chromosome","NZ_CP032803.1",179016,179948,"-",,"rfaD","D8Z70_RS00930","WP_000587764.1",310,"MULTISPECIES: ADP-glyceromanno-heptose 6-epimerase"
"chromosome","NZ_CP032803.1",180237,181109,"+",,"yibB","D8Z70_RS00935","WP_001307464.1",290,"MULTISPECIES: protein YibB"
"chromosome","NZ_CP032803.1",181384,182580,"+",,"kbl","D8Z70_RS00940","WP_001213834.1",398,"MULTISPECIES: glycine C-acetyltransferase"
"chromosome","NZ_CP032803.1",182590,183615,"+",,,"D8Z70_RS00945","WP_000646013.1",341,"MULTISPECIES: L-threonine 3-dehydrogenase"
"chromosome","NZ_CP032803.1",183854,184870,"+",,"waaH","D8Z70_RS00950","WP_001303717.1",338,"UDP-glucuronate:LPS(HepIII) glycosyltransferase"
"chromosome","NZ_CP032803.1",184876,185835,"-",,,"D8Z70_RS00955","WP_000483856.1",319,"MULTISPECIES: divergent polysaccharide deacetylase family protein"
"chromosome","NZ_CP032803.1",185839,187122,"-",,"envC","D8Z70_RS00960","WP_001214147.1",427,"MULTISPECIES: murein hydrolase activator EnvC"
"chromosome","NZ_CP032803.1",187132,188676,"-",,"gpmM","D8Z70_RS00965","WP_000116565.1",514,"MULTISPECIES: 2,3-bisphosphoglycerate-independent phosphoglycerate mutase"
"chromosome","NZ_CP032803.1",188921,189352,"+",,,"D8Z70_RS00970","WP_001156181.1",143,"MULTISPECIES: rhodanese-like domain-containing protein"
"chromosome","NZ_CP032803.1",189494,189745,"+",,"grxC","D8Z70_RS00975","WP_000024392.1",83,"MULTISPECIES: glutaredoxin 3"
"chromosome","NZ_CP032803.1",189808,190275,"+",,"secB","D8Z70_RS00980","WP_000003377.1",155,"MULTISPECIES: protein-export chaperone SecB"
"chromosome","NZ_CP032803.1",190275,191294,"+",,"gpsA","D8Z70_RS00985","WP_001076194.1",339,"MULTISPECIES: NAD(P)H-dependent glycerol-3-phosphate dehydrogenase"
